node_1,node_2,edge
salman khan,piya goyal kapoor,"Salman Khan played the role of Suhaan Kapoor, a former superstar who was married to Piya Goyal Kapoor in the movie. They got divorced after Suhaan was fired from his career and received a divorce notice from Piya."
preity zinta,piya goyal kapoor,Preity Zinta played the dual role of Piya Goyal Kapoor and Preity Zintacova in the movie.
akshay kumar,piya goyal kapoor,"Akshay Kumar played the role of Agastya Rao / Champu, a NASA specialist who had a crush on Piya during his years in college but was rejected by her back then. He became friends with Suhaan and tried to get him and Piya together."
anupam kher,bonney kapoor / new york cafe owner,"Anupam Kher played the dual role of Bonney Kapoor, Piya's father, and the owner of a New York cafe."
nawwab shah,vishal goyal,"Nawwab Shah played the role of Vishal Goyal, Piya's brother."
soni razdan,mrs. sushma goyal,"Soni Razdan played the role of Mrs. Sushma Goyal, Piya's mother."
jawed sheikh,samrat goyal,Jawed Sheikh played the role of Samrat Goyal.
rajesh balwani,"daboo goyal, piya's cousin brother","Rajesh Balwani played the role of Daboo Goyal, Piya's cousin brother."
aman verma,zubin hornibhoy,"Aman Verma played the role of Zubin Hornibhoy, Piya's friend."
