node_1,node_2,edge
salman khan,aditya sekhri,Salman Khan portrays the character Aditya Sekhri in this movie.
sneha ullal,lucky negi,Sneha Ullal plays the role of Lucky Negi in the film.
mithun chakraborty,retired colonel pindidas kapoor,Mithun Chakraborty acts as Retired Colonel Pindidas Kapoor in the movie.
kader khan,doctor,Kader Khan essays the character of Doctor in this movie.
navni parihar,anjali negi,Navni Parihar portrays Anjali Negi in the film.
ravi baswani,vishal negi,Ravi Baswani essays the character of Vishal Negi in the movie.
vikram gokhale,ambassador sekhri,Vikram Gokhale plays the role of Ambassador Sekhri in this movie.
meher vij,padma,Meher Vij portrays Padma in the film.
mumaith khan,sunayana,Mumaith Khan acts as Sunayana in this movie.
