node_1,node_2,edge
choice movie: comedy actor,dwayne johnson,Nominated for the Choice Movie: Comedy Actor award at the Teen Choice Awards in 2017.
choice movie: comedy actor,zac efron,Nominated for the Choice Movie: Comedy Actor award at the Teen Choice Awards in 2017.
alexandra daddario,best t&a of the year,Won the Golden Schmoes Award for Best T&A of the Year in 2017.
priyanka chopra,choice movie: villain,Nominated for the Choice Movie: Villain award at the Teen Choice Awards in 2017.
michael berk,ivan reitman,Nominated for the Worst Picture award at the 38th Golden Raspberry Awards in 2018.
damian shannon,mark swift,Nominated for the Worst Screenplay award at the 38th Golden Raspberry Awards in 2018.
zac efron,worst actor,Nominated for the Worst Actor award at the 38th Golden Raspberry Awards in 2018.
choice movie: ship,dwayne johnson and zac efron,Nominated for the Choice Movie: Ship award at the Teen Choice Awards in 2017.
the razzie nominee so rotten you loved it,"worst prequel, remake, rip-off or sequel","Nominated for the Worst Prequel, Remake, Rip-off or Sequel award at the 38th Golden Raspberry Awards in 2018."
