node_1,node_2,edge
don't mess with texas,film,"The film was originally titled Don't Mess with Texas, indicating that it falls under the category of films."
"may 12, 2014",principal photography,"Principal photography for the film began on May 12, 2014 in New Orleans, Louisiana."
"new orleans, louisiana",principal photography location,"The principal photography for the film took place in New Orleans, Louisiana."
"may 12, 2014",two months,"Principal photography for the film was set to last for two months starting from May 12, 2014."
"february 12, 2015",first trailer release,"The film's first trailer was released on February 12, 2015."
