node_1,node_2,edge
barry sonnenfeld,director,"On 12 January 2015, it was announced Barry Sonnenfeld would direct the film."
kevin spacey,actor,"On 28 January 2015, Kevin Spacey joined the cast."
malina weissman,actor,"On 25 March 2015, Malina Weissman joined the cast."
christopher walken,actor,"On 31 March 2015, Christopher Walken joined the cast to play Felix Perkins, the owner of a mystical pet shop,"
jennifer garner,actor,"On 9 April 2015, Jennifer Garner and Robbie Amell joined as well."
robbie amell,actor,"On 9 April 2015, Jennifer Garner and Robbie Amell joined as well."
montreal,location,Filming took place in Montreal.
