node_1,node_2,edge
christian bale,katie holmes,"The romantic subplot between Christian Bale and Katie Holmes in the context had a spark ""refreshingly free of Peter Parker/Mary Jane-style whining"" according to Total Film."
christian bale,batman's arsenal,"The darkness behind Batman's arsenal was assisted by the story, psychology and reality according to Kenneth Turan from Los Angeles Times."
liam neeson,batman's arsenal,"The story, psychology and reality assisted the darkness behind Batman's arsenal according to Kenneth Turan from Los Angeles Times."
katie holmes,liam neeson,Kenneth Turan from Los Angeles Times noted that Liam Neeson and Katie Holmes did not appear to fit their respective characters in 'being both comic-book archetypes and real people'.
christian bale,hollywood's latest batman,"According to James Berardinelli, Christian Bale's performance as Hollywood's latest Batman helped create more understanding into 'who [Batman] is and what motivates him'."
batsuit,batman,"The Batsuit is the iconic suit worn by Batman, portrayed by Christian Bale in this film."
batcave,batman,"The Batcave is a secret location belonging to Batman, depicted in the movie."
tumbler,batman,"The Tumbler is a high-tech vehicle used by Batman for transportation and combat purposes, featured in this film."
batsignal,batman,"The Batsignal is a symbol used by Batman to signal his presence or request assistance, showcased in the movie."
rachel dawes,bruce wayne,"Rachel Dawes is a character who has a relationship with both Bruce Wayne and Batman, portrayed by Maggie Gyllenhaal in the movie."
serpico new york,gotham city,"In the context of the review by Kyle Smith, Serpico New York is compared to Gotham City in this film, both representing corrupt cities from different time periods."
michael keaton,christian bale,Stephanie Zacharek compares Christian Bale's portrayal of Batman in this film to Michael Keaton's performance in earlier Batman movies.
tim burton,christopher nolan,"Tim Burton, the director of previous Batman films, acknowledges Christopher Nolan for capturing the true spirit of superhero movies in this film."
batman begins,the dark knight,"both films, directed by Christopher Nolan, have had a lasting influence on the superhero film genre. While Batman Begins heralded a trend of darker genre films that either retold back-stories or rebooted them altogether, The Dark Knight is considered one of the most influential films of the 2000s. This influence can be seen in the popularity of superhero origin stories and the increased acceptance of exploring the dark side of comic book lore."
christopher nolan,superhero film genre,"Nolan's Batman trilogy, particularly Batman Begins and The Dark Knight, has had a significant impact on the evolution of superhero films. His films have been cited as one of the most influential of the 2000s and have influenced the perception of different approaches to storytelling not only in the comic book film genre but also in other genres."
chris nolan's batman,superhero films,"Nolan's Batman trilogy, particularly Batman Begins and The Dark Knight, has had a significant impact on the evolution of superhero films. Kevin Feige, film producer and president of Marvel Studios, has stated that Nolan's Batman is the greatest thing that happened to superhero films because it bolstered everything."
darker genre films,superhero films,"Batman Begins, directed by Christopher Nolan, heralded a trend of darker genre films that either retold back-stories or rebooted them altogether. Filmmakers, screenwriters, and producers have cited this trend in other films, such as Casino Royale and the upcoming RoboCop, Red Sonja, and Grayskull."
superhero origin stories,superhero films,Batman Begins' influence can be seen in the popularity of superhero origin stories. This trend has become increasingly en vogue for the genre.
dark side of comic book lore,superhero films,"Batman Begins, directed by Christopher Nolan, explored the dark side of comic book lore. This exploration has become increasingly acceptable in superhero films."
superhero film genre,comic book films,The term 'superhero film' is often used interchangeably with the term 'comic book film.' Both terms refer to movies based on comic book characters or their adventures.
fear,scarecrow,"personified by the Scarecrow in Batman Begins, as fear affects all creatures"
bruce wayne,alfred,"Alfred provides a maternal figure of unconditional love despite the overall lack of focus on a mother figure in Bruce's life, as Bruce's search for justice requires him to learn from a proper father figure with Thomas Wayne and Ra's al Ghul being the two counterpoints"
bruce wayne,fear,the idea behind the film was 'a person who would confront his innermost fear and then attempt to become it'
fear,bruce wayne,"The theme of fear is shown to affect Bruce Wayne, as he rises above it to become Batman."
scarecrow,fear,"The Scarecrow and his deadly fear toxin personify the theme of fear, showing how it affects all creatures regardless of might."
batman begins,fear,"The film depicts how fear can affect all creatures regardless of might and intensifies the theme through its musical score by Zimmer and Howard, which eschews traditional heroic themes."
bruce wayne,split personality in the bat suit,The psychological investigation of Bruce Wayne's split personality in the bat suit is lightly touched upon in Batman Begins.
bruce wayne,right thing,"Bruce Wayne is a character constantly striving to do the right thing, not worn down by incessant reexamination, in Batman Begins."
