node_1,node_2,edge
once upon a time in hollywood (music),compilation album,The soundtrack from the film is a compilation album of classic rock.
once upon a time in hollywood (music),classic rock,"The soundtrack from the film includes multiple tracks from Paul Revere & the Raiders, as well as 1960s radio ads and DJ patter."
paul revere & the raiders,classic rock,The soundtrack from the film includes multiple tracks from Paul Revere & the Raiders.
mamas & the papas,music,The film contains numerous songs from artists such as the Mamas & the Papas.
elmer bernstein,scores,"The film also contains numerous scores not included on the soundtrack, including from artists such as Elmer Bernstein."
